{
  "contractVersion": "projection-kill-switch/v1",
  "revision": 1,
  "issuedAt": "2026-10-01T00:00:00+08:00",
  "currentMarketProjection": "closed",
  "tickerSpecificShareAndShortVideo": "closed",
  "closedFactRevisionIds": [],
  "closedInstruments": [],
  "closedMarketSessionIds": [],
  "closedPaperActionRevealDates": [],
  "closedStoryActIds": []
}
